{
  "version": "1",
  "id": "pricing",
  "activeNav": "pricing",
  "sections": [
    {
      "type": "hero",
      "titleKey": "pricing.hero.title",
      "taglineKey": "pricing.hero.tagline",
      "cta": { "labelKey": "pricing.hero.cta", "action": { "type": "link", "href": "/demo.html" } }
    },
    {
      "type": "cards",
      "variant": "catalog",
      "items": [
        {
          "iconText": "START",
          "titleKey": "pricing.tiers.start.title",
          "badgeKey": "pricing.tiers.start.badge",
          "descKey": "pricing.tiers.start.desc",
          "action": { "labelKey": "pricing.tiers.start.action", "variant": "glass", "action": { "type": "link", "href": "/demo.html" } }
        },
        {
          "iconText": "GROW",
          "titleKey": "pricing.tiers.grow.title",
          "badgeKey": "pricing.tiers.grow.badge",
          "descKey": "pricing.tiers.grow.desc",
          "action": { "labelKey": "pricing.tiers.grow.action", "variant": "glass", "action": { "type": "link", "href": "/demo.html" } }
        },
        {
          "iconText": "SOV",
          "titleKey": "pricing.tiers.sov.title",
          "badgeKey": "pricing.tiers.sov.badge",
          "descKey": "pricing.tiers.sov.desc",
          "action": { "labelKey": "pricing.tiers.sov.action", "variant": "glass", "action": { "type": "link", "href": "/demo.html" } }
        }
      ]
    },
    {
      "type": "cards",
      "variant": "catalog",
      "items": [
        {
          "iconText": "SEC",
          "titleKey": "pricing.included.security.title",
          "badgeKey": "pricing.included.security.badge",
          "descKey": "pricing.included.security.desc"
        },
        {
          "iconText": "OPS",
          "titleKey": "pricing.included.ops.title",
          "badgeKey": "pricing.included.ops.badge",
          "descKey": "pricing.included.ops.desc"
        },
        {
          "iconText": "SUP",
          "titleKey": "pricing.included.support.title",
          "badgeKey": "pricing.included.support.badge",
          "descKey": "pricing.included.support.desc"
        }
      ]
    },
    {
      "type": "cta",
      "titleKey": "pricing.social.title",
      "bodyKey": "pricing.social.body",
      "primary": { "labelKey": "pricing.social.primary", "action": { "type": "link", "href": "/demo.html" } },
      "secondary": { "labelKey": "pricing.social.secondary", "action": { "type": "link", "href": "/manifesto" } }
    }
  ]
}
