{
  "version": "1",
  "id": "demo",
  "activeNav": "demo",
  "sections": [
    {
      "type": "hero",
      "titleKey": "demo.hero.title",
      "taglineKey": "demo.hero.lead",
      "cta": { "labelKey": "demo.form.submit", "action": { "type": "link", "href": "/demo" } }
    },
    {
      "type": "cards",
      "variant": "catalog",
      "items": [
        {
          "iconText": "S",
          "titleKey": "demo.badges.sovereign",
          "descKey": "demo.testimonial.text"
        },
        {
          "iconText": "N",
          "titleKey": "demo.badges.n8n",
          "descKey": "demo.testimonial.author"
        },
        {
          "iconText": "O",
          "titleKey": "demo.badges.oracle",
          "descKey": "demo.hero.lead"
        }
      ]
    },
    {
      "type": "cta",
      "titleKey": "demo.form.legal",
      "primary": { "labelKey": "demo.form.submit", "action": { "type": "link", "href": "/demo" } },
      "secondary": { "labelKey": "nav.home", "action": { "type": "link", "href": "/" } }
    },
    { "type": "spacer", "size": "lg" }
  ]
}

